{
  "schema_version": "1.0",
  "record_type": "public_compute_profile",
  "profile_id": "machine-001",
  "collection_scope": "host",
  "system": {
    "os_family": "Linux",
    "architecture": "x86_64",
    "logical_cpus": 24,
    "memory_total_gib": 29.9,
    "cpu_groups": [
      {
        "model": "AMD Ryzen 9 9900X 12-Core Processor",
        "cores_per_socket": 12.0,
        "sockets": 1.0,
        "threads_per_core": 2.0
      }
    ]
  },
  "software": {
    "docker_version": "29.1.3",
    "nvidia_container_toolkit_version": "1.20.1",
    "driver_cuda_max_version": "13.2"
  },
  "gpus": [
    {
      "device": "gpu-1",
      "model": "NVIDIA GeForce RTX 5090",
      "memory_architecture": "dedicated",
      "memory_total_mib": 32607.0,
      "power_limit_w": 575.0,
      "max_sm_clock_mhz": 3090.0,
      "max_memory_clock_mhz": 14001.0,
      "pcie_max_generation": 5.0,
      "pcie_max_width": 16.0,
      "compute_capability": "12.0",
      "driver_version": "595.91.07"
    }
  ],
  "capabilities": {
    "nvidia_gpu_count": 1,
    "cuda_devices_detected": true,
    "multi_gpu": false,
    "shared_system_gpu_memory": false
  },
  "limitations": [
    "Hardware discovery does not verify framework compatibility or model fit.",
    "CUDA version is driver compatibility, not installed toolkit version.",
    "GPU memory is per device; multiple devices are not a shared VRAM pool.",
    "Null values indicate unavailable or unsupported counters.",
    "Hardware combinations may be recognizable despite removal of direct identifiers."
  ]
}
