{
  "schema_version": "1.0",
  "record_type": "public_compute_profile",
  "profile_id": "machine-002",
  "collection_scope": "host",
  "system": {
    "os_family": "Linux",
    "architecture": "x86_64",
    "logical_cpus": 8,
    "memory_total_gib": 23.5,
    "cpu_groups": [
      {
        "model": "Intel(R) Xeon(R) CPU           X3440  @ 2.53GHz",
        "cores_per_socket": 4.0,
        "sockets": 1.0,
        "threads_per_core": 2.0
      }
    ]
  },
  "software": {
    "docker_version": "29.1.3",
    "nvidia_container_toolkit_version": "1.19.0",
    "driver_cuda_max_version": null
  },
  "gpus": [
    {
      "device": "gpu-1",
      "model": "NVIDIA GeForce RTX 3080",
      "memory_architecture": "dedicated",
      "memory_total_mib": 10240.0,
      "power_limit_w": 320.0,
      "max_sm_clock_mhz": 2100.0,
      "max_memory_clock_mhz": 9501.0,
      "pcie_max_generation": 2.0,
      "pcie_max_width": 16.0,
      "compute_capability": "8.6",
      "driver_version": "580.173.02"
    },
    {
      "device": "gpu-2",
      "model": "NVIDIA GeForce RTX 3070 Ti",
      "memory_architecture": "dedicated",
      "memory_total_mib": 8192.0,
      "power_limit_w": 290.0,
      "max_sm_clock_mhz": 2100.0,
      "max_memory_clock_mhz": 9501.0,
      "pcie_max_generation": 2.0,
      "pcie_max_width": 16.0,
      "compute_capability": "8.6",
      "driver_version": "580.173.02"
    },
    {
      "device": "gpu-3",
      "model": "NVIDIA GeForce RTX 3070",
      "memory_architecture": "dedicated",
      "memory_total_mib": 8192.0,
      "power_limit_w": 220.0,
      "max_sm_clock_mhz": 2100.0,
      "max_memory_clock_mhz": 7001.0,
      "pcie_max_generation": 1.0,
      "pcie_max_width": 16.0,
      "compute_capability": "8.6",
      "driver_version": "580.173.02"
    }
  ],
  "capabilities": {
    "nvidia_gpu_count": 3,
    "cuda_devices_detected": true,
    "multi_gpu": true,
    "shared_system_gpu_memory": false
  },
  "limitations": [
    "Hardware discovery does not verify framework compatibility or model fit.",
    "CUDA version is driver compatibility, not installed toolkit version.",
    "GPU memory is per device; multiple devices are not a shared VRAM pool.",
    "Null values indicate unavailable or unsupported counters.",
    "Hardware combinations may be recognizable despite removal of direct identifiers."
  ]
}
